{
  "id": "20571103776",
  "source": "strava",
  "original_source": "peloton",
  "activity_type": "Biking",
  "name": null,
  "start_time": "2026-07-24T19:19:53Z",
  "timezone": null,
  "elapsed_time_s": 1200.0,
  "moving_time_s": null,
  "calories": 282.6,
  "average_heart_rate": 135.8,
  "max_heart_rate": 156.0,
  "device_name": null,
  "endurance_metrics": null,
  "strength_metrics": null,
  "class_metrics": {
    "instructor": null,
    "class_title": null,
    "class_type": "Biking",
    "output_kj": 214.08364
  },
  "raw_file_reference": "20571103776.tcx.gz",
  "ingested_at": "2026-08-04T22:22:23.739016+00:00"
}