{
  "id": "837628003",
  "source": "strava",
  "original_source": "garmin",
  "activity_type": "cycling",
  "name": null,
  "start_time": "2016-10-27T22:41:25",
  "timezone": null,
  "elapsed_time_s": 781.64,
  "moving_time_s": 726.7,
  "calories": 236,
  "average_heart_rate": null,
  "max_heart_rate": null,
  "device_name": "edge810",
  "endurance_metrics": {
    "distance_m": 4570.5,
    "average_speed_mps": 6.289,
    "max_speed_mps": 16.233,
    "elevation_gain_m": 42,
    "average_cadence": 50,
    "average_power_w": null,
    "max_power_w": null,
    "gps_track_available": true
  },
  "strength_metrics": null,
  "class_metrics": null,
  "raw_file_reference": "837628003.fit.gz",
  "ingested_at": "2026-08-04T22:06:01.449890+00:00"
}