{
  "id": "882023980",
  "source": "strava",
  "original_source": "garmin",
  "activity_type": "cycling",
  "name": "Ride to Cycling Social",
  "start_time": "2016-12-07T22:55:00",
  "timezone": null,
  "elapsed_time_s": 476.105,
  "moving_time_s": 475.3,
  "calories": 68,
  "average_heart_rate": 124,
  "max_heart_rate": 148,
  "device_name": "edge810",
  "endurance_metrics": {
    "distance_m": 2072.45,
    "average_speed_mps": 4.36,
    "max_speed_mps": 10.6,
    "elevation_gain_m": 14,
    "average_cadence": 29,
    "average_power_w": null,
    "max_power_w": null,
    "gps_track_available": true
  },
  "strength_metrics": null,
  "class_metrics": null,
  "raw_file_reference": "882023980.fit.gz",
  "ingested_at": "2026-08-04T22:06:24.563043+00:00"
}